{
  "$contract": "soter://contracts/context-snapshot/v1",
  "contractVersion": "1.0.0",
  "id": "context.project-pulse.no-invented-progress-fixture",
  "runId": "run.project-pulse.no-invented-progress-fixture",
  "createdAt": "2026-07-16T12:00:00.000Z",
  "configurationLockFingerprint": "sha256:7201839fc2b63148976907e762848483067f7fd502ed936fac44df71b5550cb8",
  "graphFingerprint": "sha256:d7e65fdf94e860c2fc05e53939d5bf56961285fcf3a60096d51a9299a3f511b5",
  "containment": "fixture",
  "entries": [
    {
      "id": "context.project-pulse.policy-selection",
      "subject": "projects.records",
      "authority": "authority.projects.definition",
      "role": "definition",
      "capability": "projects.records.read",
      "providerPack": "integration.notion",
      "providerImplementation": "provider.integration.notion.fixture",
      "providerVersion": "0.4.0",
      "observedAt": "2026-07-16T12:00:00.000Z",
      "freshness": "passed",
      "provenance": {
        "provider": "notion-fixture",
        "authority": "authority.projects.definition",
        "mapping": "mapping.integration.notion.projects-records",
        "mappingVersion": "0.4.0",
        "sourceKind": "fixture",
        "sourceReferenceFingerprint": "sha256:06611ce2387850fc65b5a25c52e32699f06a2ed9c4843e40c96942d8ab3ab090"
      },
      "valueFingerprint": "sha256:dc3ebeb9ee6fecf535ec994e97840250f0c272f76c5e29742a955aa3846f4be2",
      "value": {
        "records": [
          {
            "type": "project-work-policy",
            "id": "policy.projects",
            "version": "1",
            "fields": {
              "name": "Projects",
              "progressRequiresPromotedTasks": true,
              "milestoneWorkItemsRemainDistinct": true,
              "healthMustBeOperatorJudgment": true,
              "writesRequireConfirmation": true,
              "updateCategory": "Status",
              "defaultProcessed": false,
              "allowedUpdateCategories": [
                "Update",
                "Status",
                "Decision",
                "Question",
                "Milestone"
              ],
              "allowedVisibilities": [
                "Internal",
                "Agent",
                "Public"
              ],
              "duplicateCandidateLimit": 2,
              "doneTaskStatuses": [
                "done",
                "closed"
              ],
              "blockedTaskStatuses": [
                "blocked"
              ],
              "notStartedTaskStatuses": [
                "backlog",
                "to-do",
                "open"
              ],
              "allowedProgressStates": [
                "todo",
                "in-progress",
                "done"
              ],
              "allowedHealthStates": [
                "on-track",
                "at-risk",
                "off-track"
              ],
              "milestoneSyntaxVersion": "project-milestone-line/v1",
              "workItemSyntaxVersion": "dated-owner-action-line/v1",
              "milestoneProgressRule": "promoted-task-state-with-human-completion",
              "promotionBoundary": "tracked-execution-only",
              "coordinationDisposition": "complete-in-place",
              "promotionTaskContext": "Project",
              "promotionMarksTrackedWorkComplete": false,
              "decisionCategory": "Decision",
              "questionCategory": "Question",
              "decisionSummaryGrammar": "what-decided-by-why/v1",
              "questionSummaryGrammar": "question-owner-needed-by/v1",
              "missingDecisionWhyMarker": "[why not supplied]",
              "decisionResolutionRequiresQuestion": true,
              "decisionResolutionRequiresWorkItem": true
            },
            "identityBinding": {
              "state": "exact-request",
              "requestedIdFingerprint": "sha256:614074553571e79cb6b4d0ba91805ea8ab0d3a03f4ef677f18d1e11c127227d5"
            }
          }
        ],
        "provenance": {
          "provider": "notion-fixture",
          "authority": "authority.projects.definition",
          "mapping": "mapping.integration.notion.projects-records",
          "mappingVersion": "0.4.0",
          "sourceKind": "fixture",
          "sourceReferenceFingerprint": "sha256:06611ce2387850fc65b5a25c52e32699f06a2ed9c4843e40c96942d8ab3ab090"
        },
        "observedAt": "2026-07-16T12:00:00.000Z"
      }
    },
    {
      "id": "context.project-pulse.project",
      "subject": "projects.records",
      "authority": "authority.projects.instance",
      "role": "instance",
      "capability": "projects.records.read",
      "providerPack": "integration.notion",
      "providerImplementation": "provider.integration.notion.fixture",
      "providerVersion": "0.4.0",
      "observedAt": "2026-07-16T12:00:00.000Z",
      "freshness": "passed",
      "provenance": {
        "provider": "notion-fixture",
        "authority": "authority.projects.instance",
        "mapping": "mapping.integration.notion.projects-records",
        "mappingVersion": "0.4.0",
        "sourceKind": "fixture",
        "sourceReferenceFingerprint": "sha256:06611ce2387850fc65b5a25c52e32699f06a2ed9c4843e40c96942d8ab3ab090"
      },
      "valueFingerprint": "sha256:c73cb3ccc41cffef66354cdb00535a809b8e038bdf8cf2f7476e5bee59a03d5a",
      "value": {
        "records": [
          {
            "type": "project",
            "id": "https://www.notion.so/33333333333333333333333333333331",
            "version": "1",
            "fields": {
              "name": "Sparse discovery",
              "status": "active",
              "taskUris": []
            },
            "identityBinding": {
              "state": "exact-request",
              "requestedIdFingerprint": "sha256:3eb8b4fe63cc019c7eb8681fb8389e53075f67edf602253f1b3a0ed38c4d07cf"
            }
          }
        ],
        "provenance": {
          "provider": "notion-fixture",
          "authority": "authority.projects.instance",
          "mapping": "mapping.integration.notion.projects-records",
          "mappingVersion": "0.4.0",
          "sourceKind": "fixture",
          "sourceReferenceFingerprint": "sha256:06611ce2387850fc65b5a25c52e32699f06a2ed9c4843e40c96942d8ab3ab090"
        },
        "observedAt": "2026-07-16T12:00:00.000Z"
      }
    },
    {
      "id": "context.project-pulse.tasks",
      "subject": "tasks.records",
      "authority": "authority.tasks.instance",
      "role": "instance",
      "capability": "tasks.records.read",
      "providerPack": "integration.notion",
      "providerImplementation": "provider.integration.notion.fixture",
      "providerVersion": "0.4.0",
      "observedAt": "2026-07-16T12:00:00.000Z",
      "freshness": "passed",
      "provenance": {
        "provider": "notion-fixture",
        "authority": "authority.tasks.instance",
        "mapping": "mapping.integration.notion.tasks-records",
        "mappingVersion": "0.4.0",
        "sourceKind": "fixture",
        "sourceReferenceFingerprint": "sha256:f480b878a118346cabe6f66afc853da8477fcaed7fa81d79cdbd0998d4f6f29a"
      },
      "valueFingerprint": "sha256:05b731edc751c2095990e62c50af034989e722e6eb05b36f6cea97eb574b2a12",
      "value": {
        "records": [],
        "provenance": {
          "provider": "notion-fixture",
          "authority": "authority.tasks.instance",
          "mapping": "mapping.integration.notion.tasks-records",
          "mappingVersion": "0.4.0",
          "sourceKind": "fixture",
          "sourceReferenceFingerprint": "sha256:f480b878a118346cabe6f66afc853da8477fcaed7fa81d79cdbd0998d4f6f29a"
        },
        "observedAt": "2026-07-16T12:00:00.000Z"
      }
    },
    {
      "id": "context.project-pulse.document",
      "subject": "projects.records",
      "authority": "authority.projects.instance",
      "role": "instance",
      "capability": "documents.content.read",
      "providerPack": "integration.notion",
      "providerImplementation": "provider.integration.notion.fixture",
      "providerVersion": "0.4.0",
      "observedAt": "2026-07-16T12:00:00.000Z",
      "freshness": "passed",
      "provenance": {
        "provider": "notion-fixture",
        "authority": "authority.projects.instance",
        "sourceKind": "fixture",
        "sourceReferenceFingerprint": "sha256:f915e63efa5409d66397ad849f0a44a01ceeb42cade6ca1e921f4cdd14ef0431"
      },
      "valueFingerprint": "sha256:707ad3b76359c6b540a07411264ae7b97a279a0f975680677cd0d6989cfc5804",
      "value": {
        "document": {
          "uri": "https://www.notion.so/33333333333333333333333333333331",
          "title": "Sparse discovery",
          "format": "markdown",
          "body": "# Sparse discovery\n\n## Objectives / Milestones\n\n- [ ] **Discovery complete - ***The project has enough evidence to define delivery.*\n\t- [x] Maya - Gather source material\n\t- [x] Maya - Record open questions\n\t- [ ] @2026-07-24 - Maya - Confirm delivery scope\n",
          "bodyFingerprint": "sha256:62017a56b357b76bd081d5b2974c864c4c3beda800e7a4176dd037730525713e"
        },
        "provenance": {
          "provider": "notion-fixture",
          "authority": "authority.projects.instance",
          "sourceKind": "fixture",
          "sourceReferenceFingerprint": "sha256:f915e63efa5409d66397ad849f0a44a01ceeb42cade6ca1e921f4cdd14ef0431"
        },
        "observedAt": "2026-07-16T12:00:00.000Z"
      }
    }
  ],
  "effectIds": [
    "effect.project-pulse.policy.fixture",
    "effect.project-pulse.project.fixture",
    "effect.project-pulse.tasks.fixture",
    "effect.project-pulse.document.fixture"
  ],
  "privacy": {
    "scope": "private",
    "redactions": [
      "Provider credentials, secret references, and native responses are excluded.",
      "Project, task, policy, and document values remain in private context state and do not become workspace inspection facts."
    ]
  }
}
