{
  "$contract": "soter://contracts/context-snapshot/v1",
  "contractVersion": "1.0.0",
  "id": "context.feature-capture.preparation-fixture",
  "runId": "run.feature-capture.preparation-fixture",
  "createdAt": "2026-07-21T18:00:00.000Z",
  "configurationLockFingerprint": "sha256:dc8f330705fbf95db18c56c6dc988dbf75066314161d7e87b7a3946a5c6f0f69",
  "graphFingerprint": "sha256:b41f0979355d52af7463f1884924608bbe7f47e145cea5e75eae01debfa65b29",
  "containment": "fixture",
  "entries": [
    {
      "id": "context.feature-capture.policy",
      "subject": "product.records.feature-workflow-policy",
      "authority": "authority.product.definition",
      "role": "definition",
      "capability": "product.records.read",
      "providerPack": "integration.notion",
      "providerImplementation": "provider.integration.notion.fixture",
      "providerVersion": "0.4.0",
      "observedAt": "2026-07-21T18:00:00.000Z",
      "freshness": "passed",
      "provenance": {
        "provider": "notion-fixture",
        "authority": "authority.product.definition",
        "mapping": "mapping.integration.notion.product-records",
        "mappingVersion": "0.4.0",
        "sourceKind": "fixture",
        "sourceReferenceFingerprint": "sha256:772f5bc724483a0f2a4aca7b6f5170406ff2890b673a6c7e76f90d95db1c27ae"
      },
      "valueFingerprint": "sha256:3461e500d0cc47e3ee540c48957602de6597503f36a696e415bf29e1c47fbf9c",
      "value": {
        "record": {
          "type": "feature-workflow-policy",
          "id": "policy.feature-workflow",
          "version": "1",
          "fields": {
            "name": "Feature Development"
          },
          "identityBinding": {
            "state": "exact-request",
            "requestedIdFingerprint": "sha256:c1f1b0ee629f9732e8b2ff371fc5aac3a46f0955981c52c47745ee8ff6f81665"
          }
        },
        "definitionFingerprint": "sha256:b7e9e810b206d305690764d6231e57948f6379bf0f9548c4b99334e48ef8bfa8"
      }
    },
    {
      "id": "context.feature-capture.schema",
      "subject": "product.records.feature-schema",
      "authority": "authority.product.instance",
      "role": "instance",
      "capability": "product.schema.read",
      "providerPack": "integration.notion",
      "providerImplementation": "provider.integration.notion.fixture",
      "providerVersion": "0.4.0",
      "observedAt": "2026-07-21T18:00:00.000Z",
      "freshness": "passed",
      "provenance": {
        "provider": "notion-fixture",
        "authority": "authority.product.instance",
        "mapping": "mapping.integration.notion.product-records",
        "mappingVersion": "0.4.0",
        "sourceKind": "fixture",
        "sourceReferenceFingerprint": "sha256:113d62e3b65652464ed967ffcac5497ea6101f64cde5cd0539782392685a180f"
      },
      "valueFingerprint": "sha256:afa62d7bd665e036b4f8788b91137e09e6237f414d9fdc2ee9ee92dbf3c16683",
      "value": {
        "schema": {
          "recordType": "feature",
          "fields": [
            {
              "id": "area",
              "writable": true,
              "options": [
                "Automation",
                "Context",
                "Core",
                "Kernel"
              ]
            },
            {
              "id": "description",
              "writable": true,
              "options": null
            },
            {
              "id": "featureType",
              "writable": true,
              "options": [
                "Bug",
                "Content",
                "Enhancement",
                "Feature"
              ]
            },
            {
              "id": "name",
              "writable": true,
              "options": null
            },
            {
              "id": "priority",
              "writable": true,
              "options": [
                "Later",
                "Next",
                "Now"
              ]
            },
            {
              "id": "status",
              "writable": true,
              "options": [
                "Canceled",
                "Completed",
                "In Development",
                "Planned",
                "Up Next"
              ]
            }
          ],
          "fingerprint": "sha256:29184b37156bd1f502531f4b3baf43d9fd65694a99ad09b636d9a49e0067c1c5"
        },
        "provenance": {
          "provider": "notion-fixture",
          "authority": "authority.product.instance",
          "mapping": "mapping.integration.notion.product-records",
          "mappingVersion": "0.4.0",
          "sourceKind": "fixture",
          "sourceReferenceFingerprint": "sha256:113d62e3b65652464ed967ffcac5497ea6101f64cde5cd0539782392685a180f"
        },
        "observedAt": "2026-07-21T18:00:00.000Z"
      }
    },
    {
      "id": "context.feature-capture.candidates",
      "subject": "product.records.feature-candidates",
      "authority": "authority.product.instance",
      "role": "instance",
      "capability": "product.records.read",
      "providerPack": "integration.notion",
      "providerImplementation": "provider.integration.notion.fixture",
      "providerVersion": "0.4.0",
      "observedAt": "2026-07-21T18:00:00.000Z",
      "freshness": "passed",
      "provenance": {
        "provider": "notion-fixture",
        "authority": "authority.product.instance",
        "mapping": "mapping.integration.notion.product-records",
        "mappingVersion": "0.4.0",
        "sourceKind": "fixture",
        "sourceReferenceFingerprint": "sha256:772f5bc724483a0f2a4aca7b6f5170406ff2890b673a6c7e76f90d95db1c27ae"
      },
      "valueFingerprint": "sha256:2c7a5433f60dd27a215da55d4f0aa26f43c6c9adf89fa3661e854db208c4f97b",
      "value": {
        "candidateCount": 0,
        "candidateIds": [],
        "providerOutputFingerprint": "sha256:0c8c24bab8c8a2c1772fd3e41fa5174b64c174bae38fa5db7a42ef604fb38668"
      }
    }
  ],
  "effectIds": [
    "effect.feature-capture.preparation.policy.fixture",
    "effect.feature-capture.preparation.schema.fixture",
    "effect.feature-capture.preparation.candidates.fixture"
  ],
  "privacy": {
    "scope": "private",
    "redactions": [
      "Feature name, why, body text, requested options, provider target identity, candidate values, native responses, and credentials are excluded from general inspection."
    ]
  }
}
