{
  "$contract": "soter://contracts/context-snapshot/v1",
  "contractVersion": "1.0.0",
  "id": "context.task-capture.preparation-fixture",
  "runId": "run.task-capture.preparation-fixture",
  "createdAt": "2026-07-16T15:00:00.000Z",
  "configurationLockFingerprint": "sha256:1f8565810fee46bdff6d0d43228502cc0eac60383f19a2901753337dfd477a8b",
  "graphFingerprint": "sha256:ae7ec1e422097c2d537078447559307f51fbc0a9d0309f5ce2629ea058982b31",
  "containment": "fixture",
  "entries": [
    {
      "id": "context.task-capture.policy",
      "subject": "tasks.records.task-work-policy",
      "authority": "authority.tasks.definition",
      "role": "definition",
      "capability": "tasks.records.read",
      "providerPack": "integration.notion",
      "providerImplementation": "provider.integration.notion.fixture",
      "providerVersion": "0.4.0",
      "observedAt": "2026-07-16T15:00:00.000Z",
      "freshness": "passed",
      "provenance": {
        "provider": "notion-fixture",
        "authority": "authority.tasks.definition",
        "mapping": "mapping.integration.notion.tasks-records",
        "mappingVersion": "0.4.0",
        "sourceKind": "fixture",
        "sourceReferenceFingerprint": "sha256:f480b878a118346cabe6f66afc853da8477fcaed7fa81d79cdbd0998d4f6f29a"
      },
      "valueFingerprint": "sha256:4a8ce4bc8e4fe41997e13c9adaa3dc15264b00327d0d6f10a2364f50baaed32f",
      "value": {
        "records": [
          {
            "type": "task-work-policy",
            "id": "policy.tasks",
            "version": "1",
            "fields": {
              "name": "Tasks",
              "createRequiresConfirmation": true,
              "duplicateCandidateLimit": 10,
              "duplicateKeyFields": [
                "title"
              ],
              "defaultStatus": "To Do",
              "allowedContexts": [
                "Internal",
                "Service",
                "Project",
                "Client"
              ],
              "projectRequired": true,
              "assigneePolicy": "current-user-or-unassigned"
            },
            "identityBinding": {
              "state": "exact-request",
              "requestedIdFingerprint": "sha256:6cd51a314791b67027dff3f73feb5c82c7f642f6e4e91858901d09810043b26d"
            }
          }
        ],
        "provenance": {
          "provider": "notion-fixture",
          "authority": "authority.tasks.definition",
          "mapping": "mapping.integration.notion.tasks-records",
          "mappingVersion": "0.4.0",
          "sourceKind": "fixture",
          "sourceReferenceFingerprint": "sha256:f480b878a118346cabe6f66afc853da8477fcaed7fa81d79cdbd0998d4f6f29a"
        },
        "observedAt": "2026-07-16T15:00:00.000Z"
      }
    },
    {
      "id": "context.task-capture.project",
      "subject": "projects.records.project",
      "authority": "authority.projects.instance",
      "role": "instance",
      "capability": "projects.records.read",
      "providerPack": "integration.notion",
      "providerImplementation": "provider.integration.notion.fixture",
      "providerVersion": "0.4.0",
      "observedAt": "2026-07-16T15:00:00.000Z",
      "freshness": "passed",
      "provenance": {
        "provider": "notion-fixture",
        "authority": "authority.projects.instance",
        "mapping": "mapping.integration.notion.projects-records",
        "mappingVersion": "0.4.0",
        "sourceKind": "fixture",
        "sourceReferenceFingerprint": "sha256:06611ce2387850fc65b5a25c52e32699f06a2ed9c4843e40c96942d8ab3ab090"
      },
      "valueFingerprint": "sha256:2e8605d9784ce62763fad8c46143fddd6490bffb4eeb5dd0fc0500e7d2bbabf0",
      "value": {
        "records": [
          {
            "type": "project",
            "id": "soter-fixture://projects/project/launch",
            "version": "1",
            "fields": {
              "name": "Acme launch",
              "status": "active",
              "organizationUris": [
                "soter-fixture://crm/organization/acme"
              ],
              "taskUris": [
                "soter-fixture://tasks/task/existing-deck"
              ]
            },
            "identityBinding": {
              "state": "exact-request",
              "requestedIdFingerprint": "sha256:8d0f79bee2c2683c2290d65622eea4862d76364b0ba300add965a3a5e071a6ce"
            }
          }
        ],
        "provenance": {
          "provider": "notion-fixture",
          "authority": "authority.projects.instance",
          "mapping": "mapping.integration.notion.projects-records",
          "mappingVersion": "0.4.0",
          "sourceKind": "fixture",
          "sourceReferenceFingerprint": "sha256:06611ce2387850fc65b5a25c52e32699f06a2ed9c4843e40c96942d8ab3ab090"
        },
        "observedAt": "2026-07-16T15:00:00.000Z"
      }
    },
    {
      "id": "context.task-capture.identity",
      "subject": "notion.workspace.current-user",
      "authority": "authority.notion.provider",
      "role": "provider",
      "capability": "workspace.identity.read",
      "providerPack": "integration.notion",
      "providerImplementation": "provider.integration.notion.fixture",
      "providerVersion": "0.4.0",
      "observedAt": "2026-07-16T15:00:00.000Z",
      "freshness": "passed",
      "provenance": {
        "provider": "notion-fixture",
        "authority": "authority.notion.provider",
        "sourceKind": "fixture",
        "sourceReferenceFingerprint": "sha256:fba96dd124786906deac3173b004cf264261d14806396ade46da4ace8c3e6e77"
      },
      "valueFingerprint": "sha256:4c30a8b44ee7c1e9516f854ee003822baf80f497a35ece383ae88e5112532dcc",
      "value": {
        "identity": {
          "kind": "current-user",
          "providerPersonId": "provider-person.maya",
          "fingerprint": "sha256:fcfa59de1ec300265f6f8e71d97dfe7413cdfc9c4e6a5e81250a18b693b812ff"
        },
        "provenance": {
          "provider": "notion-fixture",
          "authority": "authority.notion.provider",
          "sourceKind": "fixture",
          "sourceReferenceFingerprint": "sha256:fba96dd124786906deac3173b004cf264261d14806396ade46da4ace8c3e6e77"
        },
        "observedAt": "2026-07-16T15:00:00.000Z"
      }
    },
    {
      "id": "context.task-capture.duplicates",
      "subject": "tasks.records.task-candidates",
      "authority": "authority.tasks.instance",
      "role": "instance",
      "capability": "tasks.records.read",
      "providerPack": "integration.notion",
      "providerImplementation": "provider.integration.notion.fixture",
      "providerVersion": "0.4.0",
      "observedAt": "2026-07-16T15:00:00.000Z",
      "freshness": "passed",
      "provenance": {
        "provider": "notion-fixture",
        "authority": "authority.tasks.instance",
        "mapping": "mapping.integration.notion.tasks-records",
        "mappingVersion": "0.4.0",
        "sourceKind": "fixture",
        "sourceReferenceFingerprint": "sha256:f480b878a118346cabe6f66afc853da8477fcaed7fa81d79cdbd0998d4f6f29a"
      },
      "valueFingerprint": "sha256:9c330252455f8bfe637754602e33ec9ec5202a396a39f116d896553712c26166",
      "value": {
        "candidateCount": 0,
        "candidateIds": [],
        "providerOutputFingerprint": "sha256:97b78072b952635a1acf54851280f95f01c2ac3fbba5b89b51895653905e84d6"
      }
    }
  ],
  "effectIds": [
    "effect.task-capture.preparation.policy.fixture",
    "effect.task-capture.preparation.project.fixture",
    "effect.task-capture.preparation.identity.fixture",
    "effect.task-capture.preparation.duplicates.fixture"
  ],
  "privacy": {
    "scope": "private",
    "redactions": [
      "Provider credentials, raw private inputs, and duplicate candidate field values are excluded."
    ]
  }
}
